{
  "version": 1,
  "adapter": "fake",
  "model": null,
  "mode": "Auto",
  "iterations": 1,
  "intervalSeconds": 0,
  "timeoutSeconds": 3600,
  "adapters": {
    "fake": {
      "executable": "C:\\Program Files\\nodejs\\node.exe",
      "args": [
        "C:\\GitHub\\DynastyWars_GA\\artifacts\\loop-tests\\1790483323551-ef23a72e-ea81-452e-ac8b-7a33846e37b0\\4-fixture with spaces 中文\\fake adapter 中文.mjs",
        "{requestFile}",
        "{resultFile}",
        "argument with spaces",
        "中文",
        "& echo NOT_SHELL",
        "quote\"value"
      ]
    }
  }
}