{"version":1,"adapter":"fake","model":null,"mode":"Auto","iterations":1,"intervalSeconds":0,"timeoutSeconds":3600,"adapters":{"fake":{"executable":"C:\\GitHub\\DynastyWars_GA\\artifacts\\loop-tests\\1790476764960-5103aea1-f6bb-4c79-9e89-88c71e23ab78\\20-fixture with spaces 中文\\missing-executable","args":["C:\\GitHub\\DynastyWars_GA\\artifacts\\loop-tests\\1790476764960-5103aea1-f6bb-4c79-9e89-88c71e23ab78\\20-fixture with spaces 中文\\fake adapter 中文.mjs","{requestFile}","{resultFile}","argument with spaces","中文","& echo NOT_SHELL","quote\"value"]}}}